{"schema":"ling.semantic-query/0.1","semantic_schema":"ling.semantic/0.1","language_version":"0.0.1-dev","unicode_version":"17.0.0","program_id":"experimental:blake3:0000000000000000000000000000000000000000000000000000000000000000","symbol":"value","matches":[{"definition_id":"experimental:blake3:1111111111111111111111111111111111111111111111111111111111111111","body_id":"experimental:blake3:2222222222222222222222222222222222222222222222222222222222222222","module":"Main","name":"value","kind":"value","type":"Int","effects":[],"capabilities":[]}]}
